[
  {"slug":"return","term":"Return","aliases":["Performance"],"summary":"The percentage change between two observations in a price or NAV series.","formula":{"expression":"(ending value / starting value - 1) * 100","provenance":[{"label":"SEBI Investor: technical and fundamental analysis","url":"https://investor.sebi.gov.in/tech_fund_analysis.html"}]},"interpretation":"It describes change over a selected window, not the path taken.","pitfalls":["Price return can omit distributions."],"assetClasses":["equity","etf","mutual_fund"],"sources":[{"label":"SEBI Investor: technical and fundamental analysis","url":"https://investor.sebi.gov.in/tech_fund_analysis.html"}],"reviewedAt":"2026-09-07"},
  {"slug":"volume","term":"Volume","aliases":["Traded volume"],"summary":"The number of units traded during a listed-market session.","interpretation":"It puts a price move in participation context.","pitfalls":["Volume is not traded value."],"assetClasses":["equity","etf"],"sources":[{"label":"SEBI Investor: technical and fundamental analysis","url":"https://investor.sebi.gov.in/tech_fund_analysis.html"}],"reviewedAt":"2026-09-07"},
  {"slug":"average-volume","term":"Average volume","aliases":["Weekly average volume"],"summary":"The arithmetic mean of daily traded units across a stated window.","formula":{"expression":"sum of daily volumes / observed sessions","provenance":[{"label":"SEBI Investor: technical and fundamental analysis","url":"https://investor.sebi.gov.in/tech_fund_analysis.html"}]},"interpretation":"Comparing current volume with its average shows participation context.","pitfalls":["Outlier sessions can skew the average."],"assetClasses":["equity","etf"],"sources":[{"label":"SEBI Investor: technical and fundamental analysis","url":"https://investor.sebi.gov.in/tech_fund_analysis.html"}],"reviewedAt":"2026-09-07"},
  {"slug":"market-cap","term":"Market capitalisation","aliases":["Market cap","Market capitalization"],"summary":"The market value of a company’s outstanding shares at the quoted price.","formula":{"expression":"share price * shares outstanding","provenance":[{"label":"SEBI Investor: investor education videos","url":"https://investor.sebi.gov.in/inv_aware_edu_videos.html"}]},"interpretation":"It is a size measure, not intrinsic value or enterprise value.","pitfalls":["Total and free-float market cap differ."],"assetClasses":["equity"],"sources":[{"label":"SEBI Investor: investor education videos","url":"https://investor.sebi.gov.in/inv_aware_edu_videos.html"}],"reviewedAt":"2026-09-07"},
  {"slug":"moving-average","term":"Moving average","aliases":["MA","SMA"],"summary":"A rolling average of prices or NAVs used to smooth variation.","formula":{"expression":"sum of last N observations / N","provenance":[{"label":"NSE India: technical and fundamental analysis course","url":"https://www.nseindia.com/static/learn/technical-fundamental-analysis-capital-market"}]},"interpretation":"It is a lagging baseline for describing recent strength or weakness.","pitfalls":["The lookback changes the signal."],"assetClasses":["equity","etf","mutual_fund"],"sources":[{"label":"NSE India: technical and fundamental analysis course","url":"https://www.nseindia.com/static/learn/technical-fundamental-analysis-capital-market"}],"reviewedAt":"2026-09-07"},
  {"slug":"52-week-high","term":"52-week high","aliases":["52 week high","One-year high"],"summary":"The highest observed price in a trailing 52-week window.","formula":{"expression":"max(observed prices over trailing 52 weeks)","provenance":[{"label":"NSE India: technical and fundamental analysis course","url":"https://www.nseindia.com/static/learn/technical-fundamental-analysis-capital-market"}]},"interpretation":"Distance to the high places the latest observation in its recent range.","pitfalls":["Adjustment conventions must be consistent."],"assetClasses":["equity","etf"],"sources":[{"label":"NSE India: technical and fundamental analysis course","url":"https://www.nseindia.com/static/learn/technical-fundamental-analysis-capital-market"}],"reviewedAt":"2026-09-07"},
  {"slug":"relative-strength-benchmark","term":"Relative strength versus benchmark","aliases":["Benchmark-relative RS","Relative performance"],"summary":"This dashboard’s documented methodology compares an asset’s return with a chosen benchmark over the same interval.","formula":{"expression":"((1 + asset return) / (1 + benchmark return) - 1) * 100","provenance":[{"label":"Stonks methodology","url":"/learn/relative-strength-benchmark"}]},"interpretation":"A positive result means outperformance for that window; it is not RSI.","pitfalls":["Benchmark choice changes the result."],"assetClasses":["equity","etf"],"sources":[{"label":"SEBI Investor: technical and fundamental analysis","url":"https://investor.sebi.gov.in/tech_fund_analysis.html"}],"reviewedAt":"2026-09-07"},
  {"slug":"relative-strength-rating","term":"Relative strength rating","aliases":["RS Rating","Cohort RS rating"],"summary":"This dashboard’s documented methodology ranks relative strength within an asset-class cohort.","formula":{"expression":"Stonks methodology: stable percentile rank scaled 1-99","provenance":[{"label":"Stonks methodology","url":"/learn/relative-strength-rating"}]},"interpretation":"Higher values mean stronger relative performance inside this cohort.","pitfalls":["Cohort-relative scores are not universal ratings."],"assetClasses":["equity","etf"],"sources":[{"label":"SEBI Investor: technical and fundamental analysis","url":"https://investor.sebi.gov.in/tech_fund_analysis.html"},{"label":"NSE India: technical and fundamental analysis course","url":"https://www.nseindia.com/static/learn/technical-fundamental-analysis-capital-market"}],"reviewedAt":"2026-09-07"},
  {"slug":"volatility","term":"Volatility","aliases":["Annualized volatility"],"summary":"A measure of how widely periodic returns vary, annualized for comparison.","formula":{"expression":"standard deviation of periodic returns * square root of periods per year","provenance":[{"label":"Nifty Indices: important indicators","url":"https://niftyindices.com/resources/tutorial/important-indicators"}]},"interpretation":"Higher volatility means a wider historical range of outcomes.","pitfalls":["Historical volatility is backward-looking."],"assetClasses":["equity","etf","mutual_fund"],"sources":[{"label":"Nifty Indices: important indicators","url":"https://niftyindices.com/resources/tutorial/important-indicators"}],"reviewedAt":"2026-09-07"},
  {"slug":"drawdown","term":"Drawdown","aliases":["Maximum drawdown","Peak-to-trough decline"],"summary":"The decline from a prior running peak to a later observation in a price or NAV series.","formula":{"expression":"(current value / prior running peak - 1) * 100","provenance":[{"label":"Stonks methodology","url":"/learn/drawdown"}]},"interpretation":"Maximum drawdown captures the deepest peak-to-trough fall in the selected history.","pitfalls":["It does not describe recovery time."],"assetClasses":["equity","etf","mutual_fund"],"sources":[{"label":"SEBI Investor: technical and fundamental analysis","url":"https://investor.sebi.gov.in/tech_fund_analysis.html"}],"reviewedAt":"2026-09-07"},
  {"slug":"nav","term":"Net asset value (NAV)","aliases":["NAV","Net asset value per unit"],"summary":"The per-unit value of a mutual fund scheme after valuing assets and subtracting liabilities.","formula":{"expression":"(scheme assets - scheme liabilities) / units outstanding","provenance":[{"label":"AMFI: Net Asset Value","url":"https://www.amfiindia.com/investor/knowledge-center-info?zoneName=NetAssetValueNAV"},{"label":"SEBI Investor: Net Asset Value","url":"https://investor.sebi.gov.in/securities-mf-investments.html"}]},"interpretation":"Percentage change in NAV is more useful than comparing absolute NAV levels.","pitfalls":["A lower NAV is not automatically cheaper or better."],"assetClasses":["mutual_fund"],"sources":[{"label":"AMFI: Net Asset Value","url":"https://www.amfiindia.com/investor/knowledge-center-info?zoneName=NetAssetValueNAV"},{"label":"SEBI Investor: Net Asset Value","url":"https://investor.sebi.gov.in/securities-mf-investments.html"}],"reviewedAt":"2026-09-07"},
  {"slug":"roe","term":"Return on equity (ROE)","aliases":["ROE"],"summary":"A profitability ratio relating net income to owners’ equity.","formula":{"expression":"net income / average or reported total equity","provenance":[{"label":"CFA Institute: DuPont return on equity explainer","url":"https://blogs.cfainstitute.org/blog/2013/01/23/how-much-does-apple-make-a-dupont-analysis/"}]},"interpretation":"It indicates accounting profit generated per unit of equity under the stated convention.","pitfalls":["Leverage and denominator timing affect comparisons."],"assetClasses":["equity"],"sources":[{"label":"CFA Institute: DuPont return on equity explainer","url":"https://blogs.cfainstitute.org/blog/2013/01/23/how-much-does-apple-make-a-dupont-analysis/"}],"reviewedAt":"2026-09-07"},
  {"slug":"roce","term":"Return on capital employed (ROCE)","aliases":["ROCE"],"summary":"A profitability ratio relating operating earnings to capital committed to the business.","formula":{"expression":"operating profit or EBIT / capital employed","provenance":[{"label":"CFA Institute: financial ratio list","url":"https://www.cfainstitute.org/sites/default/files/-/media/documents/support/programs/cfa/cfa_program_level_ii_financial_ratio_list.pdf"}]},"interpretation":"It can describe operating efficiency independent of financing mix when definitions are consistent.","pitfalls":["EBIT and capital-employed definitions vary."],"assetClasses":["equity"],"sources":[{"label":"CFA Institute: financial ratio list","url":"https://www.cfainstitute.org/sites/default/files/-/media/documents/support/programs/cfa/cfa_program_level_ii_financial_ratio_list.pdf"}],"reviewedAt":"2026-09-07"},